No.     Time           Source                Destination           Protocol Length Info
      1 0.000000       MS-NLB-PhysServer-16_18:3e:84:bb                       ARP      62     Who has 192.168.0.246? Tell 192.168.0.1

Frame 1: 62 bytes on wire (496 bits), 62 bytes captured (496 bits)
Linux cooked capture v1
Address Resolution Protocol (request)

No.     Time           Source                Destination           Protocol Length Info
      2 0.000013       b8:1e:a4:c6:02:27                           ARP      44     192.168.0.246 is at b8:1e:a4:c6:02:27

Frame 2: 44 bytes on wire (352 bits), 44 bytes captured (352 bits)
Linux cooked capture v1
Address Resolution Protocol (reply)

No.     Time           Source                Destination           Protocol Length Info
      3 0.718543       192.168.0.246         34.199.23.206         TCP      68     33024 → 80 [ACK] Seq=1 Ack=1 Win=249 Len=0 TSval=2325455492 TSecr=3718027239

Frame 3: 68 bytes on wire (544 bits), 68 bytes captured (544 bits)
Linux cooked capture v1
Internet Protocol Version 4, Src: 192.168.0.246, Dst: 34.199.23.206
Transmission Control Protocol, Src Port: 33024, Dst Port: 80, Seq: 1, Ack: 1, Len: 0

No.     Time           Source                Destination           Protocol Length Info
      4 0.812494       fe80::10:18ff:fe3e:84bb fe80::47b7:4ee7:175c:217 ICMPv6   88     Neighbor Solicitation for fe80::47b7:4ee7:175c:217 from 02:10:18:3e:84:bb

Frame 4: 88 bytes on wire (704 bits), 88 bytes captured (704 bits)
Linux cooked capture v1
Internet Protocol Version 6, Src: fe80::10:18ff:fe3e:84bb, Dst: fe80::47b7:4ee7:175c:217
Internet Control Message Protocol v6

No.     Time           Source                Destination           Protocol Length Info
      5 0.812518       fe80::47b7:4ee7:175c:217 fe80::10:18ff:fe3e:84bb ICMPv6   80     Neighbor Advertisement fe80::47b7:4ee7:175c:217 (sol)

Frame 5: 80 bytes on wire (640 bits), 80 bytes captured (640 bits)
Linux cooked capture v1
Internet Protocol Version 6, Src: fe80::47b7:4ee7:175c:217, Dst: fe80::10:18ff:fe3e:84bb
Internet Control Message Protocol v6

No.     Time           Source                Destination           Protocol Length Info
      6 0.940439       34.199.23.206         192.168.0.246         TCP      68     [TCP ACKed unseen segment] 80 → 33024 [ACK] Seq=1 Ack=2 Win=110 Len=0 TSval=3718037545 TSecr=2325414136

Frame 6: 68 bytes on wire (544 bits), 68 bytes captured (544 bits)
Linux cooked capture v1
Internet Protocol Version 4, Src: 34.199.23.206, Dst: 192.168.0.246
Transmission Control Protocol, Src Port: 80, Dst Port: 33024, Seq: 1, Ack: 2, Len: 0

No.     Time           Source                Destination           Protocol Length Info
      7 1.240599       2a02:2788:624:76f:314a:cdca:821b:6da5 2606:4700:4400::ac40:9bd1 TLSv1.2  127    Application Data

Frame 7: 127 bytes on wire (1016 bits), 127 bytes captured (1016 bits)
Linux cooked capture v1
Internet Protocol Version 6, Src: 2a02:2788:624:76f:314a:cdca:821b:6da5, Dst: 2606:4700:4400::ac40:9bd1
Transmission Control Protocol, Src Port: 39002, Dst Port: 443, Seq: 1, Ack: 1, Len: 39
Transport Layer Security

No.     Time           Source                Destination           Protocol Length Info
      8 1.240636       2a02:2788:624:76f:314a:cdca:821b:6da5 2606:4700:4400::6812:202f TLSv1.2  127    Application Data

Frame 8: 127 bytes on wire (1016 bits), 127 bytes captured (1016 bits)
Linux cooked capture v1
Internet Protocol Version 6, Src: 2a02:2788:624:76f:314a:cdca:821b:6da5, Dst: 2606:4700:4400::6812:202f
Transmission Control Protocol, Src Port: 53418, Dst Port: 443, Seq: 1, Ack: 1, Len: 39
Transport Layer Security

No.     Time           Source                Destination           Protocol Length Info
      9 1.240805       2a02:2788:624:76f:314a:cdca:821b:6da5 2606:4700:4400::ac40:9bd1 TLSv1.2  112    Application Data

Frame 9: 112 bytes on wire (896 bits), 112 bytes captured (896 bits)
Linux cooked capture v1
Internet Protocol Version 6, Src: 2a02:2788:624:76f:314a:cdca:821b:6da5, Dst: 2606:4700:4400::ac40:9bd1
Transmission Control Protocol, Src Port: 39002, Dst Port: 443, Seq: 40, Ack: 1, Len: 24
Transport Layer Security

No.     Time           Source                Destination           Protocol Length Info
     10 1.240954       2a02:2788:624:76f:314a:cdca:821b:6da5 2606:4700:4400::6812:202f TLSv1.2  112    Application Data

Frame 10: 112 bytes on wire (896 bits), 112 bytes captured (896 bits)
Linux cooked capture v1
Internet Protocol Version 6, Src: 2a02:2788:624:76f:314a:cdca:821b:6da5, Dst: 2606:4700:4400::6812:202f
Transmission Control Protocol, Src Port: 53418, Dst Port: 443, Seq: 40, Ack: 1, Len: 24
Transport Layer Security

No.     Time           Source                Destination           Protocol Length Info
     11 1.274152       2606:4700:4400::ac40:9bd1 2a02:2788:624:76f:314a:cdca:821b:6da5 TCP      88     443 → 39002 [ACK] Seq=1 Ack=65 Win=10 Len=0 TSval=279305248 TSecr=1214067596

Frame 11: 88 bytes on wire (704 bits), 88 bytes captured (704 bits)
Linux cooked capture v1
Internet Protocol Version 6, Src: 2606:4700:4400::ac40:9bd1, Dst: 2a02:2788:624:76f:314a:cdca:821b:6da5
Transmission Control Protocol, Src Port: 443, Dst Port: 39002, Seq: 1, Ack: 65, Len: 0

No.     Time           Source                Destination           Protocol Length Info
     12 1.274731       2606:4700:4400::ac40:9bd1 2a02:2788:624:76f:314a:cdca:821b:6da5 TCP      88     443 → 39002 [FIN, ACK] Seq=1 Ack=65 Win=10 Len=0 TSval=279305249 TSecr=1214067596

Frame 12: 88 bytes on wire (704 bits), 88 bytes captured (704 bits)
Linux cooked capture v1
Internet Protocol Version 6, Src: 2606:4700:4400::ac40:9bd1, Dst: 2a02:2788:624:76f:314a:cdca:821b:6da5
Transmission Control Protocol, Src Port: 443, Dst Port: 39002, Seq: 1, Ack: 65, Len: 0

No.     Time           Source                Destination           Protocol Length Info
     13 1.274732       2606:4700:4400::6812:202f 2a02:2788:624:76f:314a:cdca:821b:6da5 TCP      88     443 → 53418 [ACK] Seq=1 Ack=65 Win=12 Len=0 TSval=1187242541 TSecr=375102453

Frame 13: 88 bytes on wire (704 bits), 88 bytes captured (704 bits)
Linux cooked capture v1
Internet Protocol Version 6, Src: 2606:4700:4400::6812:202f, Dst: 2a02:2788:624:76f:314a:cdca:821b:6da5
Transmission Control Protocol, Src Port: 443, Dst Port: 53418, Seq: 1, Ack: 65, Len: 0

No.     Time           Source                Destination           Protocol Length Info
     14 1.274749       2a02:2788:624:76f:314a:cdca:821b:6da5 2606:4700:4400::ac40:9bd1 TCP      88     39002 → 443 [ACK] Seq=65 Ack=2 Win=1917 Len=0 TSval=1214067630 TSecr=279305249

Frame 14: 88 bytes on wire (704 bits), 88 bytes captured (704 bits)
Linux cooked capture v1
Internet Protocol Version 6, Src: 2a02:2788:624:76f:314a:cdca:821b:6da5, Dst: 2606:4700:4400::ac40:9bd1
Transmission Control Protocol, Src Port: 39002, Dst Port: 443, Seq: 65, Ack: 2, Len: 0

No.     Time           Source                Destination           Protocol Length Info
     15 1.282442       2606:4700:4400::6812:202f 2a02:2788:624:76f:314a:cdca:821b:6da5 TCP      88     443 → 53418 [FIN, ACK] Seq=1 Ack=65 Win=12 Len=0 TSval=1187242543 TSecr=375102453

Frame 15: 88 bytes on wire (704 bits), 88 bytes captured (704 bits)
Linux cooked capture v1
Internet Protocol Version 6, Src: 2606:4700:4400::6812:202f, Dst: 2a02:2788:624:76f:314a:cdca:821b:6da5
Transmission Control Protocol, Src Port: 443, Dst Port: 53418, Seq: 1, Ack: 65, Len: 0

No.     Time           Source                Destination           Protocol Length Info
     16 1.282452       2a02:2788:624:76f:314a:cdca:821b:6da5 2606:4700:4400::6812:202f TCP      88     53418 → 443 [ACK] Seq=65 Ack=2 Win=249 Len=0 TSval=375102494 TSecr=1187242543

Frame 16: 88 bytes on wire (704 bits), 88 bytes captured (704 bits)
Linux cooked capture v1
Internet Protocol Version 6, Src: 2a02:2788:624:76f:314a:cdca:821b:6da5, Dst: 2606:4700:4400::6812:202f
Transmission Control Protocol, Src Port: 53418, Dst Port: 443, Seq: 65, Ack: 2, Len: 0

No.     Time           Source                Destination           Protocol Length Info
     17 1.424334       fe80::10:18ff:fe3e:84bb ff02::1               ICMPv6   176    Router Advertisement from 02:10:18:3e:84:bb

Frame 17: 176 bytes on wire (1408 bits), 176 bytes captured (1408 bits)
Linux cooked capture v1
Internet Protocol Version 6, Src: fe80::10:18ff:fe3e:84bb, Dst: ff02::1
Internet Control Message Protocol v6

No.     Time           Source                Destination           Protocol Length Info
     18 1.434817       fe80::47b7:4ee7:175c:217 ff02::16              ICMPv6   172    Multicast Listener Report Message v2

Frame 18: 172 bytes on wire (1376 bits), 172 bytes captured (1376 bits)
Linux cooked capture v1
Internet Protocol Version 6, Src: fe80::47b7:4ee7:175c:217, Dst: ff02::16
Internet Control Message Protocol v6

No.     Time           Source                Destination           Protocol Length Info
     19 2.000591       66.241.124.46         192.168.0.246         TCP      68     443 → 49998 [ACK] Seq=1 Ack=1 Win=35 Len=0 TSval=2070311299 TSecr=1967444663

Frame 19: 68 bytes on wire (544 bits), 68 bytes captured (544 bits)
Linux cooked capture v1
Internet Protocol Version 4, Src: 66.241.124.46, Dst: 192.168.0.246
Transmission Control Protocol, Src Port: 443, Dst Port: 49998, Seq: 1, Ack: 1, Len: 0

No.     Time           Source                Destination           Protocol Length Info
     20 2.000621       192.168.0.246         66.241.124.46         TCP      68     [TCP ACKed unseen segment] 49998 → 443 [ACK] Seq=1 Ack=2 Win=249 Len=0 TSval=1967449429 TSecr=2070282720

Frame 20: 68 bytes on wire (544 bits), 68 bytes captured (544 bits)
Linux cooked capture v1
Internet Protocol Version 4, Src: 192.168.0.246, Dst: 66.241.124.46
Transmission Control Protocol, Src Port: 49998, Dst Port: 443, Seq: 1, Ack: 2, Len: 0

No.     Time           Source                Destination           Protocol Length Info
     21 2.382846       fe80::47b7:4ee7:175c:217 ff02::16              ICMPv6   172    Multicast Listener Report Message v2

Frame 21: 172 bytes on wire (1376 bits), 172 bytes captured (1376 bits)
Linux cooked capture v1
Internet Protocol Version 6, Src: fe80::47b7:4ee7:175c:217, Dst: ff02::16
Internet Control Message Protocol v6

No.     Time           Source                Destination           Protocol Length Info
     22 2.510559       192.168.0.246         34.199.23.206         TCP      68     33038 → 80 [ACK] Seq=1 Ack=1 Win=272 Len=0 TSval=2325457284 TSecr=3718028864

Frame 22: 68 bytes on wire (544 bits), 68 bytes captured (544 bits)
Linux cooked capture v1
Internet Protocol Version 4, Src: 192.168.0.246, Dst: 34.199.23.206
Transmission Control Protocol, Src Port: 33038, Dst Port: 80, Seq: 1, Ack: 1, Len: 0

No.     Time           Source                Destination           Protocol Length Info
     23 2.706777       2a02:2788:624:76f:314a:cdca:821b:6da5 2600:1901:1:a8::      TLSv1.2  131    Application Data

Frame 23: 131 bytes on wire (1048 bits), 131 bytes captured (1048 bits)
Linux cooked capture v1
Internet Protocol Version 6, Src: 2a02:2788:624:76f:314a:cdca:821b:6da5, Dst: 2600:1901:1:a8::
Transmission Control Protocol, Src Port: 43954, Dst Port: 443, Seq: 1, Ack: 1, Len: 43
Transport Layer Security

No.     Time           Source                Destination           Protocol Length Info
     24 2.707967       34.199.23.206         192.168.0.246         TCP      68     [TCP ACKed unseen segment] 80 → 33038 [ACK] Seq=1 Ack=2 Win=114 Len=0 TSval=3718039310 TSecr=2325426327

Frame 24: 68 bytes on wire (544 bits), 68 bytes captured (544 bits)
Linux cooked capture v1
Internet Protocol Version 4, Src: 34.199.23.206, Dst: 192.168.0.246
Transmission Control Protocol, Src Port: 80, Dst Port: 33038, Seq: 1, Ack: 2, Len: 0

No.     Time           Source                Destination           Protocol Length Info
     25 2.728755       2600:1901:1:a8::      2a02:2788:624:76f:314a:cdca:821b:6da5 TLSv1.2  128    Application Data

Frame 25: 128 bytes on wire (1024 bits), 128 bytes captured (1024 bits)
Linux cooked capture v1
Internet Protocol Version 6, Src: 2600:1901:1:a8::, Dst: 2a02:2788:624:76f:314a:cdca:821b:6da5
Transmission Control Protocol, Src Port: 443, Dst Port: 43954, Seq: 1, Ack: 44, Len: 40
Transport Layer Security

No.     Time           Source                Destination           Protocol Length Info
     26 2.728782       2a02:2788:624:76f:314a:cdca:821b:6da5 2600:1901:1:a8::      TCP      88     43954 → 443 [ACK] Seq=44 Ack=41 Win=249 Len=0 TSval=1608901813 TSecr=3410275129

Frame 26: 88 bytes on wire (704 bits), 88 bytes captured (704 bits)
Linux cooked capture v1
Internet Protocol Version 6, Src: 2a02:2788:624:76f:314a:cdca:821b:6da5, Dst: 2600:1901:1:a8::
Transmission Control Protocol, Src Port: 43954, Dst Port: 443, Seq: 44, Ack: 41, Len: 0

No.     Time           Source                Destination           Protocol Length Info
     27 2.918435       192.168.0.246         34.117.188.166        TLSv1.2  107    Application Data

Frame 27: 107 bytes on wire (856 bits), 107 bytes captured (856 bits)
Linux cooked capture v1
Internet Protocol Version 4, Src: 192.168.0.246, Dst: 34.117.188.166
Transmission Control Protocol, Src Port: 54106, Dst Port: 443, Seq: 1, Ack: 1, Len: 39
Transport Layer Security

No.     Time           Source                Destination           Protocol Length Info
     28 2.919152       2a02:2788:624:76f:314a:cdca:821b:6da5 2a00:1450:400c:c0a::5e TLSv1.2  127    Application Data

Frame 28: 127 bytes on wire (1016 bits), 127 bytes captured (1016 bits)
Linux cooked capture v1
Internet Protocol Version 6, Src: 2a02:2788:624:76f:314a:cdca:821b:6da5, Dst: 2a00:1450:400c:c0a::5e
Transmission Control Protocol, Src Port: 60470, Dst Port: 443, Seq: 1, Ack: 1, Len: 39
Transport Layer Security

No.     Time           Source                Destination           Protocol Length Info
     29 3.071735       34.117.188.166        192.168.0.246         TCP      68     443 → 54106 [ACK] Seq=1 Ack=40 Win=287 Len=0 TSval=1033362222 TSecr=128584792

Frame 29: 68 bytes on wire (544 bits), 68 bytes captured (544 bits)
Linux cooked capture v1
Internet Protocol Version 4, Src: 34.117.188.166, Dst: 192.168.0.246
Transmission Control Protocol, Src Port: 443, Dst Port: 54106, Seq: 1, Ack: 40, Len: 0

No.     Time           Source                Destination           Protocol Length Info
     30 3.072347       34.117.188.166        192.168.0.246         TLSv1.2  107    Application Data

Frame 30: 107 bytes on wire (856 bits), 107 bytes captured (856 bits)
Linux cooked capture v1
Internet Protocol Version 4, Src: 34.117.188.166, Dst: 192.168.0.246
Transmission Control Protocol, Src Port: 443, Dst Port: 54106, Seq: 1, Ack: 40, Len: 39
Transport Layer Security

No.     Time           Source                Destination           Protocol Length Info
     31 3.072373       192.168.0.246         34.117.188.166        TCP      68     54106 → 443 [ACK] Seq=40 Ack=40 Win=249 Len=0 TSval=128584946 TSecr=1033362222

Frame 31: 68 bytes on wire (544 bits), 68 bytes captured (544 bits)
Linux cooked capture v1
Internet Protocol Version 4, Src: 192.168.0.246, Dst: 34.117.188.166
Transmission Control Protocol, Src Port: 54106, Dst Port: 443, Seq: 40, Ack: 40, Len: 0

No.     Time           Source                Destination           Protocol Length Info
     32 3.072348       2a00:1450:400c:c0a::5e 2a02:2788:624:76f:314a:cdca:821b:6da5 TLSv1.2  127    Application Data

Frame 32: 127 bytes on wire (1016 bits), 127 bytes captured (1016 bits)
Linux cooked capture v1
Internet Protocol Version 6, Src: 2a00:1450:400c:c0a::5e, Dst: 2a02:2788:624:76f:314a:cdca:821b:6da5
Transmission Control Protocol, Src Port: 443, Dst Port: 60470, Seq: 1, Ack: 40, Len: 39
Transport Layer Security

No.     Time           Source                Destination           Protocol Length Info
     33 3.072409       2a02:2788:624:76f:314a:cdca:821b:6da5 2a00:1450:400c:c0a::5e TCP      88     60470 → 443 [ACK] Seq=40 Ack=40 Win=253 Len=0 TSval=1876437876 TSecr=4156687696

Frame 33: 88 bytes on wire (704 bits), 88 bytes captured (704 bits)
Linux cooked capture v1
Internet Protocol Version 6, Src: 2a02:2788:624:76f:314a:cdca:821b:6da5, Dst: 2a00:1450:400c:c0a::5e
Transmission Control Protocol, Src Port: 60470, Dst Port: 443, Seq: 40, Ack: 40, Len: 0

No.     Time           Source                Destination           Protocol Length Info
     34 4.506118       fe80::10:18ff:fe3e:84bb ff02::1               ICMPv6   176    Router Advertisement from 02:10:18:3e:84:bb

Frame 34: 176 bytes on wire (1408 bits), 176 bytes captured (1408 bits)
Linux cooked capture v1
Internet Protocol Version 6, Src: fe80::10:18ff:fe3e:84bb, Dst: ff02::1
Internet Control Message Protocol v6

No.     Time           Source                Destination           Protocol Length Info
     35 4.518891       fe80::47b7:4ee7:175c:217 ff02::16              ICMPv6   172    Multicast Listener Report Message v2

Frame 35: 172 bytes on wire (1376 bits), 172 bytes captured (1376 bits)
Linux cooked capture v1
Internet Protocol Version 6, Src: fe80::47b7:4ee7:175c:217, Dst: ff02::16
Internet Control Message Protocol v6

No.     Time           Source                Destination           Protocol Length Info
     36 4.612200       192.168.0.16          239.255.255.250       UDP      700    61689 → 3702 Len=656

Frame 36: 700 bytes on wire (5600 bits), 700 bytes captured (5600 bits)
Linux cooked capture v1
Internet Protocol Version 4, Src: 192.168.0.16, Dst: 239.255.255.250
User Datagram Protocol, Src Port: 61689, Dst Port: 3702
Data (656 bytes)

0000  3c 3f 78 6d 6c 20 76 65 72 73 69 6f 6e 3d 22 31   <?xml version="1
0010  2e 30 22 20 65 6e 63 6f 64 69 6e 67 3d 22 75 74   .0" encoding="ut
0020  66 2d 38 22 3f 3e 3c 73 6f 61 70 3a 45 6e 76 65   f-8"?><soap:Enve
0030  6c 6f 70 65 20 78 6d 6c 6e 73 3a 73 6f 61 70 3d   lope xmlns:soap=
0040  22 68 74 74 70 3a 2f 2f 77 77 77 2e 77 33 2e 6f   "http://www.w3.o
0050  72 67 2f 32 30 30 33 2f 30 35 2f 73 6f 61 70 2d   rg/2003/05/soap-
0060  65 6e 76 65 6c 6f 70 65 22 20 78 6d 6c 6e 73 3a   envelope" xmlns:
0070  77 73 61 3d 22 68 74 74 70 3a 2f 2f 73 63 68 65   wsa="http://sche
0080  6d 61 73 2e 78 6d 6c 73 6f 61 70 2e 6f 72 67 2f   mas.xmlsoap.org/
0090  77 73 2f 32 30 30 34 2f 30 38 2f 61 64 64 72 65   ws/2004/08/addre
00a0  73 73 69 6e 67 22 20 78 6d 6c 6e 73 3a 77 73 64   ssing" xmlns:wsd
00b0  3d 22 68 74 74 70 3a 2f 2f 73 63 68 65 6d 61 73   ="http://schemas
00c0  2e 78 6d 6c 73 6f 61 70 2e 6f 72 67 2f 77 73 2f   .xmlsoap.org/ws/
00d0  32 30 30 35 2f 30 34 2f 64 69 73 63 6f 76 65 72   2005/04/discover
00e0  79 22 3e 3c 73 6f 61 70 3a 48 65 61 64 65 72 3e   y"><soap:Header>
00f0  3c 77 73 61 3a 54 6f 3e 75 72 6e 3a 73 63 68 65   <wsa:To>urn:sche
0100  6d 61 73 2d 78 6d 6c 73 6f 61 70 2d 6f 72 67 3a   mas-xmlsoap-org:
0110  77 73 3a 32 30 30 35 3a 30 34 3a 64 69 73 63 6f   ws:2005:04:disco
0120  76 65 72 79 3c 2f 77 73 61 3a 54 6f 3e 3c 77 73   very</wsa:To><ws
0130  61 3a 41 63 74 69 6f 6e 3e 68 74 74 70 3a 2f 2f   a:Action>http://
0140  73 63 68 65 6d 61 73 2e 78 6d 6c 73 6f 61 70 2e   schemas.xmlsoap.
0150  6f 72 67 2f 77 73 2f 32 30 30 35 2f 30 34 2f 64   org/ws/2005/04/d
0160  69 73 63 6f 76 65 72 79 2f 52 65 73 6f 6c 76 65   iscovery/Resolve
0170  3c 2f 77 73 61 3a 41 63 74 69 6f 6e 3e 3c 77 73   </wsa:Action><ws
0180  61 3a 4d 65 73 73 61 67 65 49 44 3e 75 72 6e 3a   a:MessageID>urn:
0190  75 75 69 64 3a 33 61 39 31 35 32 66 31 2d 38 37   uuid:3a9152f1-87
01a0  62 35 2d 34 66 34 35 2d 61 62 66 62 2d 34 66 61   b5-4f45-abfb-4fa
01b0  61 36 64 32 66 38 35 33 62 3c 2f 77 73 61 3a 4d   a6d2f853b</wsa:M
01c0  65 73 73 61 67 65 49 44 3e 3c 2f 73 6f 61 70 3a   essageID></soap:
01d0  48 65 61 64 65 72 3e 3c 73 6f 61 70 3a 42 6f 64   Header><soap:Bod
01e0  79 3e 3c 77 73 64 3a 52 65 73 6f 6c 76 65 3e 3c   y><wsd:Resolve><
01f0  77 73 61 3a 45 6e 64 70 6f 69 6e 74 52 65 66 65   wsa:EndpointRefe
0200  72 65 6e 63 65 3e 3c 77 73 61 3a 41 64 64 72 65   rence><wsa:Addre
0210  73 73 3e 75 72 6e 3a 75 75 69 64 3a 65 36 37 61   ss>urn:uuid:e67a
0220  36 31 31 32 2d 34 63 62 37 2d 35 37 37 63 2d 37   6112-4cb7-577c-7
0230  32 35 33 2d 66 33 62 33 64 61 61 63 34 34 35 39   253-f3b3daac4459
0240  3c 2f 77 73 61 3a 41 64 64 72 65 73 73 3e 3c 2f   </wsa:Address></
0250  77 73 61 3a 45 6e 64 70 6f 69 6e 74 52 65 66 65   wsa:EndpointRefe
0260  72 65 6e 63 65 3e 3c 2f 77 73 64 3a 52 65 73 6f   rence></wsd:Reso
0270  6c 76 65 3e 3c 2f 73 6f 61 70 3a 42 6f 64 79 3e   lve></soap:Body>
0280  3c 2f 73 6f 61 70 3a 45 6e 76 65 6c 6f 70 65 3e   </soap:Envelope>

No.     Time           Source                Destination           Protocol Length Info
     37 4.846580       fe80::47b7:4ee7:175c:217 ff02::16              ICMPv6   172    Multicast Listener Report Message v2

Frame 37: 172 bytes on wire (1376 bits), 172 bytes captured (1376 bits)
Linux cooked capture v1
Internet Protocol Version 6, Src: fe80::47b7:4ee7:175c:217, Dst: ff02::16
Internet Control Message Protocol v6

No.     Time           Source                Destination           Protocol Length Info
     38 5.121583       162.159.130.234       192.168.0.246         TLSv1.2  113    Application Data

Frame 38: 113 bytes on wire (904 bits), 113 bytes captured (904 bits)
Linux cooked capture v1
Internet Protocol Version 4, Src: 162.159.130.234, Dst: 192.168.0.246
Transmission Control Protocol, Src Port: 443, Dst Port: 44056, Seq: 1, Ack: 1, Len: 45
Transport Layer Security

No.     Time           Source                Destination           Protocol Length Info
     39 5.121623       192.168.0.246         162.159.130.234       TCP      68     44056 → 443 [ACK] Seq=1 Ack=46 Win=2551 Len=0 TSval=3835975643 TSecr=2588658457

Frame 39: 68 bytes on wire (544 bits), 68 bytes captured (544 bits)
Linux cooked capture v1
Internet Protocol Version 4, Src: 192.168.0.246, Dst: 162.159.130.234
Transmission Control Protocol, Src Port: 44056, Dst Port: 443, Seq: 1, Ack: 46, Len: 0

No.     Time           Source                Destination           Protocol Length Info
     40 5.121975       162.159.130.234       192.168.0.246         TLSv1.2  109    Application Data

Frame 40: 109 bytes on wire (872 bits), 109 bytes captured (872 bits)
Linux cooked capture v1
Internet Protocol Version 4, Src: 162.159.130.234, Dst: 192.168.0.246
Transmission Control Protocol, Src Port: 443, Dst Port: 44056, Seq: 46, Ack: 1, Len: 41
Transport Layer Security

No.     Time           Source                Destination           Protocol Length Info
     41 5.121990       192.168.0.246         162.159.130.234       TCP      68     44056 → 443 [ACK] Seq=1 Ack=87 Win=2551 Len=0 TSval=3835975643 TSecr=2588658473

Frame 41: 68 bytes on wire (544 bits), 68 bytes captured (544 bits)
Linux cooked capture v1
Internet Protocol Version 4, Src: 192.168.0.246, Dst: 162.159.130.234
Transmission Control Protocol, Src Port: 44056, Dst Port: 443, Seq: 1, Ack: 87, Len: 0

No.     Time           Source                Destination           Protocol Length Info
     42 5.241112       192.168.0.246         64.233.167.105        TLSv1.2  107    Application Data

Frame 42: 107 bytes on wire (856 bits), 107 bytes captured (856 bits)
Linux cooked capture v1
Internet Protocol Version 4, Src: 192.168.0.246, Dst: 64.233.167.105
Transmission Control Protocol, Src Port: 58074, Dst Port: 443, Seq: 1, Ack: 1, Len: 39
Transport Layer Security

No.     Time           Source                Destination           Protocol Length Info
     43 5.241376       192.168.0.246         64.233.167.105        TLSv1.2  92     Application Data

Frame 43: 92 bytes on wire (736 bits), 92 bytes captured (736 bits)
Linux cooked capture v1
Internet Protocol Version 4, Src: 192.168.0.246, Dst: 64.233.167.105
Transmission Control Protocol, Src Port: 58074, Dst Port: 443, Seq: 40, Ack: 1, Len: 24
Transport Layer Security

No.     Time           Source                Destination           Protocol Length Info
     44 5.317585       162.159.130.234       192.168.0.246         TLSv1.2  110    Application Data

Frame 44: 110 bytes on wire (880 bits), 110 bytes captured (880 bits)
Linux cooked capture v1
Internet Protocol Version 4, Src: 162.159.130.234, Dst: 192.168.0.246
Transmission Control Protocol, Src Port: 443, Dst Port: 44056, Seq: 87, Ack: 1, Len: 42
Transport Layer Security

No.     Time           Source                Destination           Protocol Length Info
     45 5.317642       192.168.0.246         162.159.130.234       TCP      68     44056 → 443 [ACK] Seq=1 Ack=129 Win=2551 Len=0 TSval=3835975839 TSecr=2588658576

Frame 45: 68 bytes on wire (544 bits), 68 bytes captured (544 bits)
Linux cooked capture v1
Internet Protocol Version 4, Src: 192.168.0.246, Dst: 162.159.130.234
Transmission Control Protocol, Src Port: 44056, Dst Port: 443, Seq: 1, Ack: 129, Len: 0

No.     Time           Source                Destination           Protocol Length Info
     46 5.317723       162.159.130.234       192.168.0.246         TLSv1.2  110    Application Data

Frame 46: 110 bytes on wire (880 bits), 110 bytes captured (880 bits)
Linux cooked capture v1
Internet Protocol Version 4, Src: 162.159.130.234, Dst: 192.168.0.246
Transmission Control Protocol, Src Port: 443, Dst Port: 44056, Seq: 129, Ack: 1, Len: 42
Transport Layer Security

No.     Time           Source                Destination           Protocol Length Info
     47 5.317738       192.168.0.246         162.159.130.234       TCP      68     44056 → 443 [ACK] Seq=1 Ack=171 Win=2551 Len=0 TSval=3835975839 TSecr=2588658579

Frame 47: 68 bytes on wire (544 bits), 68 bytes captured (544 bits)
Linux cooked capture v1
Internet Protocol Version 4, Src: 192.168.0.246, Dst: 162.159.130.234
Transmission Control Protocol, Src Port: 44056, Dst Port: 443, Seq: 1, Ack: 171, Len: 0

No.     Time           Source                Destination           Protocol Length Info
     48 5.330983       192.168.0.246         44.207.250.251        TCP      68     56340 → 80 [ACK] Seq=1 Ack=1 Win=249 Len=0 TSval=641929298 TSecr=373658457

Frame 48: 68 bytes on wire (544 bits), 68 bytes captured (544 bits)
Linux cooked capture v1
Internet Protocol Version 4, Src: 192.168.0.246, Dst: 44.207.250.251
Transmission Control Protocol, Src Port: 56340, Dst Port: 80, Seq: 1, Ack: 1, Len: 0

No.     Time           Source                Destination           Protocol Length Info
     49 5.334564       192.168.0.246         64.233.167.105        TCP      92     [TCP Retransmission] 58074 → 443 [FIN, PSH, ACK] Seq=40 Ack=1 Win=249 Len=24 TSval=1294991826 TSecr=57431946

Frame 49: 92 bytes on wire (736 bits), 92 bytes captured (736 bits)
Linux cooked capture v1
Internet Protocol Version 4, Src: 192.168.0.246, Dst: 64.233.167.105
Transmission Control Protocol, Src Port: 58074, Dst Port: 443, Seq: 40, Ack: 1, Len: 24

No.     Time           Source                Destination           Protocol Length Info
     50 5.345225       64.233.167.105        192.168.0.246         TCP      68     443 → 58074 [FIN, ACK] Seq=1 Ack=65 Win=277 Len=0 TSval=57484625 TSecr=1294991732

Frame 50: 68 bytes on wire (544 bits), 68 bytes captured (544 bits)
Linux cooked capture v1
Internet Protocol Version 4, Src: 64.233.167.105, Dst: 192.168.0.246
Transmission Control Protocol, Src Port: 443, Dst Port: 58074, Seq: 1, Ack: 65, Len: 0

No.     Time           Source                Destination           Protocol Length Info
     51 5.345260       192.168.0.246         64.233.167.105        TCP      68     58074 → 443 [ACK] Seq=65 Ack=2 Win=249 Len=0 TSval=1294991836 TSecr=57484625

Frame 51: 68 bytes on wire (544 bits), 68 bytes captured (544 bits)
Linux cooked capture v1
Internet Protocol Version 4, Src: 192.168.0.246, Dst: 64.233.167.105
Transmission Control Protocol, Src Port: 58074, Dst Port: 443, Seq: 65, Ack: 2, Len: 0

No.     Time           Source                Destination           Protocol Length Info
     52 5.357637       64.233.167.105        192.168.0.246         TCP      80     [TCP Dup ACK 50#1] 443 → 58074 [ACK] Seq=2 Ack=65 Win=277 Len=0 TSval=57484634 TSecr=1294991826 SLE=40 SRE=65

Frame 52: 80 bytes on wire (640 bits), 80 bytes captured (640 bits)
Linux cooked capture v1
Internet Protocol Version 4, Src: 64.233.167.105, Dst: 192.168.0.246
Transmission Control Protocol, Src Port: 443, Dst Port: 58074, Seq: 2, Ack: 65, Len: 0

No.     Time           Source                Destination           Protocol Length Info
     53 5.528411       44.207.250.251        192.168.0.246         TCP      68     [TCP ACKed unseen segment] 80 → 56340 [ACK] Seq=1 Ack=2 Win=110 Len=0 TSval=373668904 TSecr=641877785

Frame 53: 68 bytes on wire (544 bits), 68 bytes captured (544 bits)
Linux cooked capture v1
Internet Protocol Version 4, Src: 44.207.250.251, Dst: 192.168.0.246
Transmission Control Protocol, Src Port: 80, Dst Port: 56340, Seq: 1, Ack: 2, Len: 0

No.     Time           Source                Destination           Protocol Length Info
     54 5.837227       162.159.130.234       192.168.0.246         TLSv1.2  116    Application Data

Frame 54: 116 bytes on wire (928 bits), 116 bytes captured (928 bits)
Linux cooked capture v1
Internet Protocol Version 4, Src: 162.159.130.234, Dst: 192.168.0.246
Transmission Control Protocol, Src Port: 443, Dst Port: 44056, Seq: 171, Ack: 1, Len: 48
Transport Layer Security

No.     Time           Source                Destination           Protocol Length Info
     55 5.837282       192.168.0.246         162.159.130.234       TCP      68     44056 → 443 [ACK] Seq=1 Ack=219 Win=2551 Len=0 TSval=3835976358 TSecr=2588659014

Frame 55: 68 bytes on wire (544 bits), 68 bytes captured (544 bits)
Linux cooked capture v1
Internet Protocol Version 4, Src: 192.168.0.246, Dst: 162.159.130.234
Transmission Control Protocol, Src Port: 44056, Dst Port: 443, Seq: 1, Ack: 219, Len: 0

No.     Time           Source                Destination           Protocol Length Info
     56 6.241605       2a02:2788:624:76f:314a:cdca:821b:6da5 2a00:1450:400c:c09::69 TLSv1.2  127    Application Data

Frame 56: 127 bytes on wire (1016 bits), 127 bytes captured (1016 bits)
Linux cooked capture v1
Internet Protocol Version 6, Src: 2a02:2788:624:76f:314a:cdca:821b:6da5, Dst: 2a00:1450:400c:c09::69
Transmission Control Protocol, Src Port: 36416, Dst Port: 443, Seq: 1, Ack: 1, Len: 39
Transport Layer Security

No.     Time           Source                Destination           Protocol Length Info
     57 6.241830       2a02:2788:624:76f:314a:cdca:821b:6da5 2a00:1450:400c:c09::69 TLSv1.2  112    Application Data

Frame 57: 112 bytes on wire (896 bits), 112 bytes captured (896 bits)
Linux cooked capture v1
Internet Protocol Version 6, Src: 2a02:2788:624:76f:314a:cdca:821b:6da5, Dst: 2a00:1450:400c:c09::69
Transmission Control Protocol, Src Port: 36416, Dst Port: 443, Seq: 40, Ack: 1, Len: 24
Transport Layer Security

No.     Time           Source                Destination           Protocol Length Info
     58 6.350238       2a00:1450:400c:c09::69 2a02:2788:624:76f:314a:cdca:821b:6da5 TCP      88     443 → 36416 [ACK] Seq=1 Ack=65 Win=277 Len=0 TSval=99936234 TSecr=2278048098

Frame 58: 88 bytes on wire (704 bits), 88 bytes captured (704 bits)
Linux cooked capture v1
Internet Protocol Version 6, Src: 2a00:1450:400c:c09::69, Dst: 2a02:2788:624:76f:314a:cdca:821b:6da5
Transmission Control Protocol, Src Port: 443, Dst Port: 36416, Seq: 1, Ack: 65, Len: 0

No.     Time           Source                Destination           Protocol Length Info
     59 6.351294       2a00:1450:400c:c09::69 2a02:2788:624:76f:314a:cdca:821b:6da5 TCP      88     443 → 36416 [FIN, ACK] Seq=1 Ack=65 Win=277 Len=0 TSval=99936234 TSecr=2278048098

Frame 59: 88 bytes on wire (704 bits), 88 bytes captured (704 bits)
Linux cooked capture v1
Internet Protocol Version 6, Src: 2a00:1450:400c:c09::69, Dst: 2a02:2788:624:76f:314a:cdca:821b:6da5
Transmission Control Protocol, Src Port: 443, Dst Port: 36416, Seq: 1, Ack: 65, Len: 0

No.     Time           Source                Destination           Protocol Length Info
     60 6.351321       2a02:2788:624:76f:314a:cdca:821b:6da5 2a00:1450:400c:c09::69 TCP      88     36416 → 443 [ACK] Seq=65 Ack=2 Win=249 Len=0 TSval=2278048207 TSecr=99936234

Frame 60: 88 bytes on wire (704 bits), 88 bytes captured (704 bits)
Linux cooked capture v1
Internet Protocol Version 6, Src: 2a02:2788:624:76f:314a:cdca:821b:6da5, Dst: 2a00:1450:400c:c09::69
Transmission Control Protocol, Src Port: 36416, Dst Port: 443, Seq: 65, Ack: 2, Len: 0

No.     Time           Source                Destination           Protocol Length Info
     61 7.167045       66.241.124.46         192.168.0.246         TCP      68     [TCP Dup ACK 19#1] 443 → 49998 [ACK] Seq=1 Ack=1 Win=35 Len=0 TSval=2070316419 TSecr=1967449429

Frame 61: 68 bytes on wire (544 bits), 68 bytes captured (544 bits)
Linux cooked capture v1
Internet Protocol Version 4, Src: 66.241.124.46, Dst: 192.168.0.246
Transmission Control Protocol, Src Port: 443, Dst Port: 49998, Seq: 1, Ack: 1, Len: 0

No.     Time           Source                Destination           Protocol Length Info
     62 7.167076       192.168.0.246         66.241.124.46         TCP      68     [TCP Dup ACK 20#1] [TCP ACKed unseen segment] 49998 → 443 [ACK] Seq=1 Ack=2 Win=249 Len=0 TSval=1967454595 TSecr=2070282720

Frame 62: 68 bytes on wire (544 bits), 68 bytes captured (544 bits)
Linux cooked capture v1
Internet Protocol Version 4, Src: 192.168.0.246, Dst: 66.241.124.46
Transmission Control Protocol, Src Port: 49998, Dst Port: 443, Seq: 1, Ack: 2, Len: 0

No.     Time           Source                Destination           Protocol Length Info
     63 7.475382       fe80::10:18ff:fe3e:84bb ff02::1               ICMPv6   176    Router Advertisement from 02:10:18:3e:84:bb

Frame 63: 176 bytes on wire (1408 bits), 176 bytes captured (1408 bits)
Linux cooked capture v1
Internet Protocol Version 6, Src: fe80::10:18ff:fe3e:84bb, Dst: ff02::1
Internet Control Message Protocol v6

No.     Time           Source                Destination           Protocol Length Info
     64 7.486837       fe80::47b7:4ee7:175c:217 ff02::16              ICMPv6   172    Multicast Listener Report Message v2

Frame 64: 172 bytes on wire (1376 bits), 172 bytes captured (1376 bits)
Linux cooked capture v1
Internet Protocol Version 6, Src: fe80::47b7:4ee7:175c:217, Dst: ff02::16
Internet Control Message Protocol v6

No.     Time           Source                Destination           Protocol Length Info
     65 7.854570       fe80::47b7:4ee7:175c:217 ff02::16              ICMPv6   172    Multicast Listener Report Message v2

Frame 65: 172 bytes on wire (1376 bits), 172 bytes captured (1376 bits)
Linux cooked capture v1
Internet Protocol Version 6, Src: fe80::47b7:4ee7:175c:217, Dst: ff02::16
Internet Control Message Protocol v6

No.     Time           Source                Destination           Protocol Length Info
     66 7.899754       162.159.130.234       192.168.0.246         TLSv1.2  135    Application Data

Frame 66: 135 bytes on wire (1080 bits), 135 bytes captured (1080 bits)
Linux cooked capture v1
Internet Protocol Version 4, Src: 162.159.130.234, Dst: 192.168.0.246
Transmission Control Protocol, Src Port: 443, Dst Port: 44056, Seq: 219, Ack: 1, Len: 67
Transport Layer Security

No.     Time           Source                Destination           Protocol Length Info
     67 7.899803       192.168.0.246         162.159.130.234       TCP      68     44056 → 443 [ACK] Seq=1 Ack=286 Win=2551 Len=0 TSval=3835978421 TSecr=2588661133

Frame 67: 68 bytes on wire (544 bits), 68 bytes captured (544 bits)
Linux cooked capture v1
Internet Protocol Version 4, Src: 192.168.0.246, Dst: 162.159.130.234
Transmission Control Protocol, Src Port: 44056, Dst Port: 443, Seq: 1, Ack: 286, Len: 0

No.     Time           Source                Destination           Protocol Length Info
     68 10.444937      fe80::10:18ff:fe3e:84bb ff02::1               ICMPv6   176    Router Advertisement from 02:10:18:3e:84:bb

Frame 68: 176 bytes on wire (1408 bits), 176 bytes captured (1408 bits)
Linux cooked capture v1
Internet Protocol Version 6, Src: fe80::10:18ff:fe3e:84bb, Dst: ff02::1
Internet Control Message Protocol v6

No.     Time           Source                Destination           Protocol Length Info
     69 10.458551      fe80::47b7:4ee7:175c:217 ff02::16              ICMPv6   172    Multicast Listener Report Message v2

Frame 69: 172 bytes on wire (1376 bits), 172 bytes captured (1376 bits)
Linux cooked capture v1
Internet Protocol Version 6, Src: fe80::47b7:4ee7:175c:217, Dst: ff02::16
Internet Control Message Protocol v6

No.     Time           Source                Destination           Protocol Length Info
     70 10.539903      162.159.130.234       192.168.0.246         TLSv1.2  112    Application Data

Frame 70: 112 bytes on wire (896 bits), 112 bytes captured (896 bits)
Linux cooked capture v1
Internet Protocol Version 4, Src: 162.159.130.234, Dst: 192.168.0.246
Transmission Control Protocol, Src Port: 443, Dst Port: 44056, Seq: 286, Ack: 1, Len: 44
Transport Layer Security

No.     Time           Source                Destination           Protocol Length Info
     71 10.539953      192.168.0.246         162.159.130.234       TCP      68     44056 → 443 [ACK] Seq=1 Ack=330 Win=2551 Len=0 TSval=3835981061 TSecr=2588663417

Frame 71: 68 bytes on wire (544 bits), 68 bytes captured (544 bits)
Linux cooked capture v1
Internet Protocol Version 4, Src: 192.168.0.246, Dst: 162.159.130.234
Transmission Control Protocol, Src Port: 44056, Dst Port: 443, Seq: 1, Ack: 330, Len: 0

No.     Time           Source                Destination           Protocol Length Info
     72 10.958550      192.168.0.246         34.199.23.206         TCP      68     [TCP Dup ACK 3#1] 33024 → 80 [ACK] Seq=1 Ack=1 Win=249 Len=0 TSval=2325465732 TSecr=3718037545

Frame 72: 68 bytes on wire (544 bits), 68 bytes captured (544 bits)
Linux cooked capture v1
Internet Protocol Version 4, Src: 192.168.0.246, Dst: 34.199.23.206
Transmission Control Protocol, Src Port: 33024, Dst Port: 80, Seq: 1, Ack: 1, Len: 0

No.     Time           Source                Destination           Protocol Length Info
     73 11.410553      fe80::47b7:4ee7:175c:217 ff02::16              ICMPv6   172    Multicast Listener Report Message v2

Frame 73: 172 bytes on wire (1376 bits), 172 bytes captured (1376 bits)
Linux cooked capture v1
Internet Protocol Version 6, Src: fe80::47b7:4ee7:175c:217, Dst: ff02::16
Internet Control Message Protocol v6

No.     Time           Source                Destination           Protocol Length Info
     74 11.461213      34.199.23.206         192.168.0.246         TCP      68     [TCP Dup ACK 6#1] [TCP ACKed unseen segment] 80 → 33024 [ACK] Seq=1 Ack=2 Win=110 Len=0 TSval=3718047717 TSecr=2325414136

Frame 74: 68 bytes on wire (544 bits), 68 bytes captured (544 bits)
Linux cooked capture v1
Internet Protocol Version 4, Src: 34.199.23.206, Dst: 192.168.0.246
Transmission Control Protocol, Src Port: 80, Dst Port: 33024, Seq: 1, Ack: 2, Len: 0

No.     Time           Source                Destination           Protocol Length Info
     75 12.288252      66.241.124.46         192.168.0.246         TCP      68     [TCP Dup ACK 19#2] 443 → 49998 [ACK] Seq=1 Ack=1 Win=35 Len=0 TSval=2070321538 TSecr=1967454595

Frame 75: 68 bytes on wire (544 bits), 68 bytes captured (544 bits)
Linux cooked capture v1
Internet Protocol Version 4, Src: 66.241.124.46, Dst: 192.168.0.246
Transmission Control Protocol, Src Port: 443, Dst Port: 49998, Seq: 1, Ack: 1, Len: 0

No.     Time           Source                Destination           Protocol Length Info
