No.     Time           Source                Destination           Protocol Length Info
      1 0.000000       54.71.162.254         10.0.3.15             TLSv1.2  1504   Server Hello

Frame 1: 1504 bytes on wire (12032 bits), 1504 bytes captured (12032 bits)
Linux cooked capture v1
Internet Protocol Version 4, Src: 54.71.162.254, Dst: 10.0.3.15
Transmission Control Protocol, Src Port: 443, Dst Port: 35560, Seq: 1, Ack: 1, Len: 1448
Transport Layer Security

No.     Time           Source                Destination           Protocol Length Info
      2 0.000019       10.0.3.15             54.71.162.254         TCP      56     35560 → 443 [ACK] Seq=1 Ack=1449 Win=30672 Len=0

Frame 2: 56 bytes on wire (448 bits), 56 bytes captured (448 bits)
Linux cooked capture v1
Internet Protocol Version 4, Src: 10.0.3.15, Dst: 54.71.162.254
Transmission Control Protocol, Src Port: 35560, Dst Port: 443, Seq: 1, Ack: 1449, Len: 0

No.     Time           Source                Destination           Protocol Length Info
      3 0.232472       54.71.162.254         10.0.3.15             TLSv1.2  1504   Certificate [TCP segment of a reassembled PDU]

Frame 3: 1504 bytes on wire (12032 bits), 1504 bytes captured (12032 bits)
Linux cooked capture v1
Internet Protocol Version 4, Src: 54.71.162.254, Dst: 10.0.3.15
Transmission Control Protocol, Src Port: 443, Dst Port: 35560, Seq: 1449, Ack: 1, Len: 1448
[2 Reassembled TCP Segments (2608 bytes): #1(1354), #3(1254)]
Transport Layer Security

No.     Time           Source                Destination           Protocol Length Info
      4 0.232496       10.0.3.15             54.71.162.254         TCP      56     35560 → 443 [ACK] Seq=1 Ack=2897 Win=30672 Len=0

Frame 4: 56 bytes on wire (448 bits), 56 bytes captured (448 bits)
Linux cooked capture v1
Internet Protocol Version 4, Src: 10.0.3.15, Dst: 54.71.162.254
Transmission Control Protocol, Src Port: 35560, Dst Port: 443, Seq: 1, Ack: 2897, Len: 0

No.     Time           Source                Destination           Protocol Length Info
      5 0.241480       54.71.162.254         10.0.3.15             TLSv1.2  209    Server Key Exchange, Server Hello Done

Frame 5: 209 bytes on wire (1672 bits), 209 bytes captured (1672 bits)
Linux cooked capture v1
Internet Protocol Version 4, Src: 54.71.162.254, Dst: 10.0.3.15
Transmission Control Protocol, Src Port: 443, Dst Port: 35560, Seq: 2897, Ack: 1, Len: 153
[2 Reassembled TCP Segments (338 bytes): #3(194), #5(144)]
Transport Layer Security
Transport Layer Security

No.     Time           Source                Destination           Protocol Length Info
      6 0.241489       10.0.3.15             54.71.162.254         TCP      56     35560 → 443 [ACK] Seq=1 Ack=3050 Win=30672 Len=0

Frame 6: 56 bytes on wire (448 bits), 56 bytes captured (448 bits)
Linux cooked capture v1
Internet Protocol Version 4, Src: 10.0.3.15, Dst: 54.71.162.254
Transmission Control Protocol, Src Port: 35560, Dst Port: 443, Seq: 1, Ack: 3050, Len: 0

No.     Time           Source                Destination           Protocol Length Info
      7 0.242656       10.0.3.15             54.71.162.254         TLSv1.2  182    Client Key Exchange, Change Cipher Spec, Encrypted Handshake Message

Frame 7: 182 bytes on wire (1456 bits), 182 bytes captured (1456 bits)
Linux cooked capture v1
Internet Protocol Version 4, Src: 10.0.3.15, Dst: 54.71.162.254
Transmission Control Protocol, Src Port: 35560, Dst Port: 443, Seq: 1, Ack: 3050, Len: 126
Transport Layer Security

No.     Time           Source                Destination           Protocol Length Info
      8 0.242762       54.71.162.254         10.0.3.15             TCP      62     443 → 35560 [ACK] Seq=3050 Ack=127 Win=65535 Len=0

Frame 8: 62 bytes on wire (496 bits), 62 bytes captured (496 bits)
Linux cooked capture v1
Internet Protocol Version 4, Src: 54.71.162.254, Dst: 10.0.3.15
Transmission Control Protocol, Src Port: 443, Dst Port: 35560, Seq: 3050, Ack: 127, Len: 0

No.     Time           Source                Destination           Protocol Length Info
      9 0.417427       35.81.254.255         10.0.3.15             TLSv1.2  107    Change Cipher Spec, Encrypted Handshake Message

Frame 9: 107 bytes on wire (856 bits), 107 bytes captured (856 bits)
Linux cooked capture v1
Internet Protocol Version 4, Src: 35.81.254.255, Dst: 10.0.3.15
Transmission Control Protocol, Src Port: 443, Dst Port: 48466, Seq: 1, Ack: 1, Len: 51
Transport Layer Security

No.     Time           Source                Destination           Protocol Length Info
     10 0.417646       10.0.3.15             35.81.254.255         TLSv1.2  1164   Application Data

Frame 10: 1164 bytes on wire (9312 bits), 1164 bytes captured (9312 bits)
Linux cooked capture v1
Internet Protocol Version 4, Src: 10.0.3.15, Dst: 35.81.254.255
Transmission Control Protocol, Src Port: 48466, Dst Port: 443, Seq: 1, Ack: 52, Len: 1108
Transport Layer Security

No.     Time           Source                Destination           Protocol Length Info
     11 0.417771       35.81.254.255         10.0.3.15             TCP      62     443 → 48466 [ACK] Seq=52 Ack=1109 Win=65535 Len=0

Frame 11: 62 bytes on wire (496 bits), 62 bytes captured (496 bits)
Linux cooked capture v1
Internet Protocol Version 4, Src: 35.81.254.255, Dst: 10.0.3.15
Transmission Control Protocol, Src Port: 443, Dst Port: 48466, Seq: 52, Ack: 1109, Len: 0

No.     Time           Source                Destination           Protocol Length Info
     12 0.430783       54.71.162.254         10.0.3.15             TLSv1.2  107    Change Cipher Spec, Encrypted Handshake Message

Frame 12: 107 bytes on wire (856 bits), 107 bytes captured (856 bits)
Linux cooked capture v1
Internet Protocol Version 4, Src: 54.71.162.254, Dst: 10.0.3.15
Transmission Control Protocol, Src Port: 443, Dst Port: 35560, Seq: 3050, Ack: 127, Len: 51
Transport Layer Security

No.     Time           Source                Destination           Protocol Length Info
     13 0.430944       10.0.3.15             54.71.162.254         TLSv1.2  87     Encrypted Alert

Frame 13: 87 bytes on wire (696 bits), 87 bytes captured (696 bits)
Linux cooked capture v1
Internet Protocol Version 4, Src: 10.0.3.15, Dst: 54.71.162.254
Transmission Control Protocol, Src Port: 35560, Dst Port: 443, Seq: 127, Ack: 3101, Len: 31
Transport Layer Security

No.     Time           Source                Destination           Protocol Length Info
     14 0.430959       10.0.3.15             54.71.162.254         TCP      56     35560 → 443 [FIN, ACK] Seq=158 Ack=3101 Win=30672 Len=0

Frame 14: 56 bytes on wire (448 bits), 56 bytes captured (448 bits)
Linux cooked capture v1
Internet Protocol Version 4, Src: 10.0.3.15, Dst: 54.71.162.254
Transmission Control Protocol, Src Port: 35560, Dst Port: 443, Seq: 158, Ack: 3101, Len: 0

No.     Time           Source                Destination           Protocol Length Info
     15 0.431040       54.71.162.254         10.0.3.15             TCP      62     443 → 35560 [ACK] Seq=3101 Ack=158 Win=65535 Len=0

Frame 15: 62 bytes on wire (496 bits), 62 bytes captured (496 bits)
Linux cooked capture v1
Internet Protocol Version 4, Src: 54.71.162.254, Dst: 10.0.3.15
Transmission Control Protocol, Src Port: 443, Dst Port: 35560, Seq: 3101, Ack: 158, Len: 0

No.     Time           Source                Destination           Protocol Length Info
     16 0.431041       54.71.162.254         10.0.3.15             TCP      62     443 → 35560 [ACK] Seq=3101 Ack=159 Win=65535 Len=0

Frame 16: 62 bytes on wire (496 bits), 62 bytes captured (496 bits)
Linux cooked capture v1
Internet Protocol Version 4, Src: 54.71.162.254, Dst: 10.0.3.15
Transmission Control Protocol, Src Port: 443, Dst Port: 35560, Seq: 3101, Ack: 159, Len: 0

No.     Time           Source                Destination           Protocol Length Info
     17 0.610712       35.81.254.255         10.0.3.15             TLSv1.2  291    Application Data

Frame 17: 291 bytes on wire (2328 bits), 291 bytes captured (2328 bits)
Linux cooked capture v1
Internet Protocol Version 4, Src: 35.81.254.255, Dst: 10.0.3.15
Transmission Control Protocol, Src Port: 443, Dst Port: 48466, Seq: 52, Ack: 1109, Len: 235
Transport Layer Security

No.     Time           Source                Destination           Protocol Length Info
     18 0.611036       10.0.3.15             35.81.254.255         TLSv1.2  87     Encrypted Alert

Frame 18: 87 bytes on wire (696 bits), 87 bytes captured (696 bits)
Linux cooked capture v1
Internet Protocol Version 4, Src: 10.0.3.15, Dst: 35.81.254.255
Transmission Control Protocol, Src Port: 48466, Dst Port: 443, Seq: 1109, Ack: 287, Len: 31
Transport Layer Security

No.     Time           Source                Destination           Protocol Length Info
     19 0.611065       10.0.3.15             35.81.254.255         TCP      56     48466 → 443 [FIN, ACK] Seq=1140 Ack=287 Win=30660 Len=0

Frame 19: 56 bytes on wire (448 bits), 56 bytes captured (448 bits)
Linux cooked capture v1
Internet Protocol Version 4, Src: 10.0.3.15, Dst: 35.81.254.255
Transmission Control Protocol, Src Port: 48466, Dst Port: 443, Seq: 1140, Ack: 287, Len: 0

No.     Time           Source                Destination           Protocol Length Info
     20 0.611176       35.81.254.255         10.0.3.15             TCP      62     443 → 48466 [ACK] Seq=287 Ack=1140 Win=65535 Len=0

Frame 20: 62 bytes on wire (496 bits), 62 bytes captured (496 bits)
Linux cooked capture v1
Internet Protocol Version 4, Src: 35.81.254.255, Dst: 10.0.3.15
Transmission Control Protocol, Src Port: 443, Dst Port: 48466, Seq: 287, Ack: 1140, Len: 0

No.     Time           Source                Destination           Protocol Length Info
     21 0.611176       35.81.254.255         10.0.3.15             TCP      62     443 → 48466 [ACK] Seq=287 Ack=1141 Win=65535 Len=0

Frame 21: 62 bytes on wire (496 bits), 62 bytes captured (496 bits)
Linux cooked capture v1
Internet Protocol Version 4, Src: 35.81.254.255, Dst: 10.0.3.15
Transmission Control Protocol, Src Port: 443, Dst Port: 48466, Seq: 287, Ack: 1141, Len: 0

No.     Time           Source                Destination           Protocol Length Info
     22 0.612108       35.81.254.255         10.0.3.15             TLSv1.2  87     Encrypted Alert

Frame 22: 87 bytes on wire (696 bits), 87 bytes captured (696 bits)
Linux cooked capture v1
Internet Protocol Version 4, Src: 35.81.254.255, Dst: 10.0.3.15
Transmission Control Protocol, Src Port: 443, Dst Port: 48466, Seq: 287, Ack: 1141, Len: 31
Transport Layer Security

No.     Time           Source                Destination           Protocol Length Info
     23 0.612121       10.0.3.15             35.81.254.255         TCP      56     48466 → 443 [RST] Seq=1141 Win=0 Len=0

Frame 23: 56 bytes on wire (448 bits), 56 bytes captured (448 bits)
Linux cooked capture v1
Internet Protocol Version 4, Src: 10.0.3.15, Dst: 35.81.254.255
Transmission Control Protocol, Src Port: 48466, Dst Port: 443, Seq: 1141, Len: 0

No.     Time           Source                Destination           Protocol Length Info
     24 0.618653       54.71.162.254         10.0.3.15             TLSv1.2  87     Encrypted Alert

Frame 24: 87 bytes on wire (696 bits), 87 bytes captured (696 bits)
Linux cooked capture v1
Internet Protocol Version 4, Src: 54.71.162.254, Dst: 10.0.3.15
Transmission Control Protocol, Src Port: 443, Dst Port: 35560, Seq: 3101, Ack: 159, Len: 31
Transport Layer Security

No.     Time           Source                Destination           Protocol Length Info
     25 0.618662       10.0.3.15             54.71.162.254         TCP      56     35560 → 443 [RST] Seq=159 Win=0 Len=0

Frame 25: 56 bytes on wire (448 bits), 56 bytes captured (448 bits)
Linux cooked capture v1
Internet Protocol Version 4, Src: 10.0.3.15, Dst: 54.71.162.254
Transmission Control Protocol, Src Port: 35560, Dst Port: 443, Seq: 159, Len: 0

No.     Time           Source                Destination           Protocol Length Info
     26 3.851204       10.0.3.15             104.117.77.210        TCP      56     54108 → 80 [ACK] Seq=1 Ack=1 Win=31230 Len=0

Frame 26: 56 bytes on wire (448 bits), 56 bytes captured (448 bits)
Linux cooked capture v1
Internet Protocol Version 4, Src: 10.0.3.15, Dst: 104.117.77.210
Transmission Control Protocol, Src Port: 54108, Dst Port: 80, Seq: 1, Ack: 1, Len: 0

No.     Time           Source                Destination           Protocol Length Info
     27 3.851450       104.117.77.210        10.0.3.15             TCP      62     [TCP ACKed unseen segment] 80 → 54108 [ACK] Seq=1 Ack=2 Win=65535 Len=0

Frame 27: 62 bytes on wire (496 bits), 62 bytes captured (496 bits)
Linux cooked capture v1
Internet Protocol Version 4, Src: 104.117.77.210, Dst: 10.0.3.15
Transmission Control Protocol, Src Port: 80, Dst Port: 54108, Seq: 1, Ack: 2, Len: 0

No.     Time           Source                Destination           Protocol Length Info
     28 3.855197       10.0.3.15             104.117.77.210        TCP      56     54124 → 80 [ACK] Seq=1 Ack=1 Win=31230 Len=0

Frame 28: 56 bytes on wire (448 bits), 56 bytes captured (448 bits)
Linux cooked capture v1
Internet Protocol Version 4, Src: 10.0.3.15, Dst: 104.117.77.210
Transmission Control Protocol, Src Port: 54124, Dst Port: 80, Seq: 1, Ack: 1, Len: 0

No.     Time           Source                Destination           Protocol Length Info
     29 3.855313       104.117.77.210        10.0.3.15             TCP      62     [TCP ACKed unseen segment] 80 → 54124 [ACK] Seq=1 Ack=2 Win=65535 Len=0

Frame 29: 62 bytes on wire (496 bits), 62 bytes captured (496 bits)
Linux cooked capture v1
Internet Protocol Version 4, Src: 104.117.77.210, Dst: 10.0.3.15
Transmission Control Protocol, Src Port: 80, Dst Port: 54124, Seq: 1, Ack: 2, Len: 0

No.     Time           Source                Destination           Protocol Length Info
     30 4.111234       10.0.3.15             104.117.77.210        TCP      56     54138 → 80 [ACK] Seq=1 Ack=1 Win=31230 Len=0

Frame 30: 56 bytes on wire (448 bits), 56 bytes captured (448 bits)
Linux cooked capture v1
Internet Protocol Version 4, Src: 10.0.3.15, Dst: 104.117.77.210
Transmission Control Protocol, Src Port: 54138, Dst Port: 80, Seq: 1, Ack: 1, Len: 0

No.     Time           Source                Destination           Protocol Length Info
     31 4.111522       104.117.77.210        10.0.3.15             TCP      62     [TCP ACKed unseen segment] 80 → 54138 [ACK] Seq=1 Ack=2 Win=65535 Len=0

Frame 31: 62 bytes on wire (496 bits), 62 bytes captured (496 bits)
Linux cooked capture v1
Internet Protocol Version 4, Src: 104.117.77.210, Dst: 10.0.3.15
Transmission Control Protocol, Src Port: 80, Dst Port: 54138, Seq: 1, Ack: 2, Len: 0

No.     Time           Source                Destination           Protocol Length Info
     32 4.363994       10.0.3.15             34.107.221.82         TCP      56     52580 → 80 [ACK] Seq=1 Ack=1 Win=31904 Len=0

Frame 32: 56 bytes on wire (448 bits), 56 bytes captured (448 bits)
Linux cooked capture v1
Internet Protocol Version 4, Src: 10.0.3.15, Dst: 34.107.221.82
Transmission Control Protocol, Src Port: 52580, Dst Port: 80, Seq: 1, Ack: 1, Len: 0

No.     Time           Source                Destination           Protocol Length Info
     33 4.364028       10.0.3.15             64.233.167.94         TCP      56     54204 → 80 [ACK] Seq=1 Ack=1 Win=31590 Len=0

Frame 33: 56 bytes on wire (448 bits), 56 bytes captured (448 bits)
Linux cooked capture v1
Internet Protocol Version 4, Src: 10.0.3.15, Dst: 64.233.167.94
Transmission Control Protocol, Src Port: 54204, Dst Port: 80, Seq: 1, Ack: 1, Len: 0

No.     Time           Source                Destination           Protocol Length Info
     34 4.364234       34.107.221.82         10.0.3.15             TCP      62     [TCP ACKed unseen segment] 80 → 52580 [ACK] Seq=1 Ack=2 Win=65535 Len=0

Frame 34: 62 bytes on wire (496 bits), 62 bytes captured (496 bits)
Linux cooked capture v1
Internet Protocol Version 4, Src: 34.107.221.82, Dst: 10.0.3.15
Transmission Control Protocol, Src Port: 80, Dst Port: 52580, Seq: 1, Ack: 2, Len: 0

No.     Time           Source                Destination           Protocol Length Info
     35 4.364234       64.233.167.94         10.0.3.15             TCP      62     [TCP ACKed unseen segment] 80 → 54204 [ACK] Seq=1 Ack=2 Win=65535 Len=0

Frame 35: 62 bytes on wire (496 bits), 62 bytes captured (496 bits)
Linux cooked capture v1
Internet Protocol Version 4, Src: 64.233.167.94, Dst: 10.0.3.15
Transmission Control Protocol, Src Port: 80, Dst Port: 54204, Seq: 1, Ack: 2, Len: 0

No.     Time           Source                Destination           Protocol Length Info
     36 6.671197       10.0.3.15             104.117.77.242        TCP      56     57074 → 80 [ACK] Seq=1 Ack=1 Win=31231 Len=0

Frame 36: 56 bytes on wire (448 bits), 56 bytes captured (448 bits)
Linux cooked capture v1
Internet Protocol Version 4, Src: 10.0.3.15, Dst: 104.117.77.242
Transmission Control Protocol, Src Port: 57074, Dst Port: 80, Seq: 1, Ack: 1, Len: 0

No.     Time           Source                Destination           Protocol Length Info
     37 6.671406       104.117.77.242        10.0.3.15             TCP      62     [TCP ACKed unseen segment] 80 → 57074 [ACK] Seq=1 Ack=2 Win=65535 Len=0

Frame 37: 62 bytes on wire (496 bits), 62 bytes captured (496 bits)
Linux cooked capture v1
Internet Protocol Version 4, Src: 104.117.77.242, Dst: 10.0.3.15
Transmission Control Protocol, Src Port: 80, Dst Port: 57074, Seq: 1, Ack: 2, Len: 0

No.     Time           Source                Destination           Protocol Length Info
     38 7.183230       10.0.3.15             104.117.77.210        TCP      56     54142 → 80 [ACK] Seq=1 Ack=1 Win=31230 Len=0

Frame 38: 56 bytes on wire (448 bits), 56 bytes captured (448 bits)
Linux cooked capture v1
Internet Protocol Version 4, Src: 10.0.3.15, Dst: 104.117.77.210
Transmission Control Protocol, Src Port: 54142, Dst Port: 80, Seq: 1, Ack: 1, Len: 0

No.     Time           Source                Destination           Protocol Length Info
     39 7.183257       10.0.3.15             104.117.77.210        TCP      56     54156 → 80 [ACK] Seq=1 Ack=1 Win=31230 Len=0

Frame 39: 56 bytes on wire (448 bits), 56 bytes captured (448 bits)
Linux cooked capture v1
Internet Protocol Version 4, Src: 10.0.3.15, Dst: 104.117.77.210
Transmission Control Protocol, Src Port: 54156, Dst Port: 80, Seq: 1, Ack: 1, Len: 0

No.     Time           Source                Destination           Protocol Length Info
     40 7.183264       10.0.3.15             104.117.77.210        TCP      56     54162 → 80 [ACK] Seq=1 Ack=1 Win=31230 Len=0

Frame 40: 56 bytes on wire (448 bits), 56 bytes captured (448 bits)
Linux cooked capture v1
Internet Protocol Version 4, Src: 10.0.3.15, Dst: 104.117.77.210
Transmission Control Protocol, Src Port: 54162, Dst Port: 80, Seq: 1, Ack: 1, Len: 0

No.     Time           Source                Destination           Protocol Length Info
     41 7.183381       104.117.77.210        10.0.3.15             TCP      62     [TCP ACKed unseen segment] 80 → 54142 [ACK] Seq=1 Ack=2 Win=65535 Len=0

Frame 41: 62 bytes on wire (496 bits), 62 bytes captured (496 bits)
Linux cooked capture v1
Internet Protocol Version 4, Src: 104.117.77.210, Dst: 10.0.3.15
Transmission Control Protocol, Src Port: 80, Dst Port: 54142, Seq: 1, Ack: 2, Len: 0

No.     Time           Source                Destination           Protocol Length Info
     42 7.183382       104.117.77.210        10.0.3.15             TCP      62     [TCP ACKed unseen segment] 80 → 54156 [ACK] Seq=1 Ack=2 Win=65535 Len=0

Frame 42: 62 bytes on wire (496 bits), 62 bytes captured (496 bits)
Linux cooked capture v1
Internet Protocol Version 4, Src: 104.117.77.210, Dst: 10.0.3.15
Transmission Control Protocol, Src Port: 80, Dst Port: 54156, Seq: 1, Ack: 2, Len: 0

No.     Time           Source                Destination           Protocol Length Info
     43 7.183382       104.117.77.210        10.0.3.15             TCP      62     [TCP ACKed unseen segment] 80 → 54162 [ACK] Seq=1 Ack=2 Win=65535 Len=0

Frame 43: 62 bytes on wire (496 bits), 62 bytes captured (496 bits)
Linux cooked capture v1
Internet Protocol Version 4, Src: 104.117.77.210, Dst: 10.0.3.15
Transmission Control Protocol, Src Port: 80, Dst Port: 54162, Seq: 1, Ack: 2, Len: 0

No.     Time           Source                Destination           Protocol Length Info
     44 7.947882       10.0.3.15             104.117.77.210        TCP      56     54170 → 80 [ACK] Seq=1 Ack=1 Win=31230 Len=0

Frame 44: 56 bytes on wire (448 bits), 56 bytes captured (448 bits)
Linux cooked capture v1
Internet Protocol Version 4, Src: 10.0.3.15, Dst: 104.117.77.210
Transmission Control Protocol, Src Port: 54170, Dst Port: 80, Seq: 1, Ack: 1, Len: 0

No.     Time           Source                Destination           Protocol Length Info
     45 7.948096       104.117.77.210        10.0.3.15             TCP      62     [TCP ACKed unseen segment] 80 → 54170 [ACK] Seq=1 Ack=2 Win=65535 Len=0

Frame 45: 62 bytes on wire (496 bits), 62 bytes captured (496 bits)
Linux cooked capture v1
Internet Protocol Version 4, Src: 104.117.77.210, Dst: 10.0.3.15
Transmission Control Protocol, Src Port: 80, Dst Port: 54170, Seq: 1, Ack: 2, Len: 0

No.     Time           Source                Destination           Protocol Length Info
     46 12.093495      10.0.3.15             10.0.3.3              DNS      86     Standard query 0xe86a A normandy.cdn.mozilla.net

Frame 46: 86 bytes on wire (688 bits), 86 bytes captured (688 bits)
Linux cooked capture v1
Internet Protocol Version 4, Src: 10.0.3.15, Dst: 10.0.3.3
User Datagram Protocol, Src Port: 43777, Dst Port: 53
Domain Name System (query)

No.     Time           Source                Destination           Protocol Length Info
     47 12.093511      10.0.3.15             10.0.3.3              DNS      86     Standard query 0x4769 AAAA normandy.cdn.mozilla.net

Frame 47: 86 bytes on wire (688 bits), 86 bytes captured (688 bits)
Linux cooked capture v1
Internet Protocol Version 4, Src: 10.0.3.15, Dst: 10.0.3.3
User Datagram Protocol, Src Port: 43777, Dst Port: 53
Domain Name System (query)

No.     Time           Source                Destination           Protocol Length Info
     48 12.096725      10.0.3.15             34.149.100.209        TLSv1.2  177    Application Data

Frame 48: 177 bytes on wire (1416 bits), 177 bytes captured (1416 bits)
Linux cooked capture v1
Internet Protocol Version 4, Src: 10.0.3.15, Dst: 34.149.100.209
Transmission Control Protocol, Src Port: 55996, Dst Port: 443, Seq: 1, Ack: 1, Len: 121
Transport Layer Security

No.     Time           Source                Destination           Protocol Length Info
     49 12.096868      34.149.100.209        10.0.3.15             TCP      62     443 → 55996 [ACK] Seq=1 Ack=122 Win=65535 Len=0

Frame 49: 62 bytes on wire (496 bits), 62 bytes captured (496 bits)
Linux cooked capture v1
Internet Protocol Version 4, Src: 34.149.100.209, Dst: 10.0.3.15
Transmission Control Protocol, Src Port: 443, Dst Port: 55996, Seq: 1, Ack: 122, Len: 0

No.     Time           Source                Destination           Protocol Length Info
     50 12.099428      10.0.3.15             10.0.3.3              DNS      89     Standard query 0x250d A services.addons.mozilla.org

Frame 50: 89 bytes on wire (712 bits), 89 bytes captured (712 bits)
Linux cooked capture v1
Internet Protocol Version 4, Src: 10.0.3.15, Dst: 10.0.3.3
User Datagram Protocol, Src Port: 55293, Dst Port: 53
Domain Name System (query)

No.     Time           Source                Destination           Protocol Length Info
     51 12.099438      10.0.3.15             10.0.3.3              DNS      89     Standard query 0xbd0c AAAA services.addons.mozilla.org

Frame 51: 89 bytes on wire (712 bits), 89 bytes captured (712 bits)
Linux cooked capture v1
Internet Protocol Version 4, Src: 10.0.3.15, Dst: 10.0.3.3
User Datagram Protocol, Src Port: 55293, Dst Port: 53
Domain Name System (query)

No.     Time           Source                Destination           Protocol Length Info
     52 12.112346      10.0.3.15             10.0.3.3              DNS      91     Standard query 0x77af A location.services.mozilla.com

Frame 52: 91 bytes on wire (728 bits), 91 bytes captured (728 bits)
Linux cooked capture v1
Internet Protocol Version 4, Src: 10.0.3.15, Dst: 10.0.3.3
User Datagram Protocol, Src Port: 60913, Dst Port: 53
Domain Name System (query)

No.     Time           Source                Destination           Protocol Length Info
     53 12.112375      10.0.3.15             10.0.3.3              DNS      91     Standard query 0x0eab AAAA location.services.mozilla.com

Frame 53: 91 bytes on wire (728 bits), 91 bytes captured (728 bits)
Linux cooked capture v1
Internet Protocol Version 4, Src: 10.0.3.15, Dst: 10.0.3.3
User Datagram Protocol, Src Port: 60913, Dst Port: 53
Domain Name System (query)

No.     Time           Source                Destination           Protocol Length Info
     54 12.798662      10.0.3.3              10.0.3.15             DNS      459    Standard query response 0xe86a A normandy.cdn.mozilla.net CNAME normandy-cdn.services.mozilla.com A 35.201.103.21 NS ns-1471.awsdns-55.org NS ns-258.awsdns-32.com NS ns-1655.awsdns-14.co.uk NS ns-679.awsdns-20.net AAAA 2600:9000:5305:bf00::1 AAAA 2600:9000:5306:7700::1 AAAA 2600:9000:5301:200::1 AAAA 2600:9000:5302:a700::1 A 205.251.197.191 A 205.251.198.119 A 205.251.193.2 A 205.251.194.167

Frame 54: 459 bytes on wire (3672 bits), 459 bytes captured (3672 bits)
Linux cooked capture v1
Internet Protocol Version 4, Src: 10.0.3.3, Dst: 10.0.3.15
User Datagram Protocol, Src Port: 53, Dst Port: 43777
Domain Name System (response)

No.     Time           Source                Destination           Protocol Length Info
     55 12.804413      34.149.100.209        10.0.3.15             TLSv1.2  133    Application Data

Frame 55: 133 bytes on wire (1064 bits), 133 bytes captured (1064 bits)
Linux cooked capture v1
Internet Protocol Version 4, Src: 34.149.100.209, Dst: 10.0.3.15
Transmission Control Protocol, Src Port: 443, Dst Port: 55996, Seq: 1, Ack: 122, Len: 77
Transport Layer Security

No.     Time           Source                Destination           Protocol Length Info
     56 12.808901      34.149.100.209        10.0.3.15             TLSv1.2  159    Application Data

Frame 56: 159 bytes on wire (1272 bits), 159 bytes captured (1272 bits)
Linux cooked capture v1
Internet Protocol Version 4, Src: 34.149.100.209, Dst: 10.0.3.15
Transmission Control Protocol, Src Port: 443, Dst Port: 55996, Seq: 78, Ack: 122, Len: 103
Transport Layer Security

No.     Time           Source                Destination           Protocol Length Info
     57 12.808974      10.0.3.15             34.149.100.209        TCP      56     55996 → 443 [ACK] Seq=122 Ack=181 Win=65535 Len=0

Frame 57: 56 bytes on wire (448 bits), 56 bytes captured (448 bits)
Linux cooked capture v1
Internet Protocol Version 4, Src: 10.0.3.15, Dst: 34.149.100.209
Transmission Control Protocol, Src Port: 55996, Dst Port: 443, Seq: 122, Ack: 181, Len: 0

No.     Time           Source                Destination           Protocol Length Info
     58 12.810370      34.149.100.209        10.0.3.15             TLSv1.2  95     Application Data

Frame 58: 95 bytes on wire (760 bits), 95 bytes captured (760 bits)
Linux cooked capture v1
Internet Protocol Version 4, Src: 34.149.100.209, Dst: 10.0.3.15
Transmission Control Protocol, Src Port: 443, Dst Port: 55996, Seq: 181, Ack: 122, Len: 39
Transport Layer Security

No.     Time           Source                Destination           Protocol Length Info
     59 12.810450      10.0.3.15             34.149.100.209        TLSv1.2  95     Application Data

Frame 59: 95 bytes on wire (760 bits), 95 bytes captured (760 bits)
Linux cooked capture v1
Internet Protocol Version 4, Src: 10.0.3.15, Dst: 34.149.100.209
Transmission Control Protocol, Src Port: 55996, Dst Port: 443, Seq: 122, Ack: 220, Len: 39
Transport Layer Security

No.     Time           Source                Destination           Protocol Length Info
     60 12.810683      34.149.100.209        10.0.3.15             TCP      62     443 → 55996 [ACK] Seq=220 Ack=161 Win=65535 Len=0

Frame 60: 62 bytes on wire (496 bits), 62 bytes captured (496 bits)
Linux cooked capture v1
Internet Protocol Version 4, Src: 34.149.100.209, Dst: 10.0.3.15
Transmission Control Protocol, Src Port: 443, Dst Port: 55996, Seq: 220, Ack: 161, Len: 0

No.     Time           Source                Destination           Protocol Length Info
     61 12.815569      10.0.3.3              10.0.3.15             DNS      466    Standard query response 0x250d A services.addons.mozilla.org A 18.239.208.10 A 18.239.208.127 A 18.239.208.72 A 18.239.208.76 NS ns-1696.awsdns-20.co.uk NS ns-144.awsdns-18.com NS ns-1140.awsdns-14.org NS ns-967.awsdns-56.net AAAA 2600:9000:5304:7400::1 AAAA 2600:9000:5300:9000::1 AAAA 2600:9000:5306:a000::1 AAAA 2600:9000:5303:c700::1 A 205.251.196.116 A 205.251.192.144 A 205.251.198.160 A 205.251.195.199

Frame 61: 466 bytes on wire (3728 bits), 466 bytes captured (3728 bits)
Linux cooked capture v1
Internet Protocol Version 4, Src: 10.0.3.3, Dst: 10.0.3.15
User Datagram Protocol, Src Port: 53, Dst Port: 55293
Domain Name System (response)

No.     Time           Source                Destination           Protocol Length Info
     62 12.825957      10.0.3.3              10.0.3.15             DNS      170    Standard query response 0xbd0c AAAA services.addons.mozilla.org SOA ns-144.awsdns-18.com

Frame 62: 170 bytes on wire (1360 bits), 170 bytes captured (1360 bits)
Linux cooked capture v1
Internet Protocol Version 4, Src: 10.0.3.3, Dst: 10.0.3.15
User Datagram Protocol, Src Port: 53, Dst Port: 55293
Domain Name System (response)

No.     Time           Source                Destination           Protocol Length Info
     63 12.826387      10.0.3.15             18.239.208.10         TCP      76     53674 → 443 [SYN] Seq=0 Win=32120 Len=0 MSS=1460 SACK_PERM=1 TSval=3643528642 TSecr=0 WS=128

Frame 63: 76 bytes on wire (608 bits), 76 bytes captured (608 bits)
Linux cooked capture v1
Internet Protocol Version 4, Src: 10.0.3.15, Dst: 18.239.208.10
Transmission Control Protocol, Src Port: 53674, Dst Port: 443, Seq: 0, Len: 0

No.     Time           Source                Destination           Protocol Length Info
     64 12.831141      10.0.3.3              10.0.3.15             DNS      463    Standard query response 0x77af A location.services.mozilla.com CNAME prod.classify-client.prod.webservices.mozgcp.net A 35.190.72.216 NS ns-cloud-e4.googledomains.com NS ns-cloud-e1.googledomains.com NS ns-cloud-e3.googledomains.com NS ns-cloud-e2.googledomains.com AAAA 2001:4860:4802:32::6e AAAA 2001:4860:4802:36::6e AAAA 2001:4860:4802:34::6e AAAA 2001:4860:4802:38::6e A 216.239.32.110 A 216.239.36.110 A 216.239.34.110 A 216.239.38.110

Frame 64: 463 bytes on wire (3704 bits), 463 bytes captured (3704 bits)
Linux cooked capture v1
Internet Protocol Version 4, Src: 10.0.3.3, Dst: 10.0.3.15
User Datagram Protocol, Src Port: 53, Dst Port: 60913
Domain Name System (response)

No.     Time           Source                Destination           Protocol Length Info
     65 12.836690      10.0.3.3              10.0.3.15             DNS      211    Standard query response 0x4769 AAAA normandy.cdn.mozilla.net CNAME normandy-cdn.services.mozilla.com SOA ns-679.awsdns-20.net

Frame 65: 211 bytes on wire (1688 bits), 211 bytes captured (1688 bits)
Linux cooked capture v1
Internet Protocol Version 4, Src: 10.0.3.3, Dst: 10.0.3.15
User Datagram Protocol, Src Port: 53, Dst Port: 43777
Domain Name System (response)

No.     Time           Source                Destination           Protocol Length Info
     66 12.836855      10.0.3.15             35.201.103.21         TCP      76     46060 → 443 [SYN] Seq=0 Win=32120 Len=0 MSS=1460 SACK_PERM=1 TSval=404247976 TSecr=0 WS=128

Frame 66: 76 bytes on wire (608 bits), 76 bytes captured (608 bits)
Linux cooked capture v1
Internet Protocol Version 4, Src: 10.0.3.15, Dst: 35.201.103.21
Transmission Control Protocol, Src Port: 46060, Dst Port: 443, Seq: 0, Len: 0

No.     Time           Source                Destination           Protocol Length Info
     67 12.847786      10.0.3.3              10.0.3.15             DNS      243    Standard query response 0x0eab AAAA location.services.mozilla.com CNAME prod.classify-client.prod.webservices.mozgcp.net SOA ns-cloud-e1.googledomains.com

Frame 67: 243 bytes on wire (1944 bits), 243 bytes captured (1944 bits)
Linux cooked capture v1
Internet Protocol Version 4, Src: 10.0.3.3, Dst: 10.0.3.15
User Datagram Protocol, Src Port: 53, Dst Port: 60913
Domain Name System (response)

No.     Time           Source                Destination           Protocol Length Info
     68 12.854568      10.0.3.15             35.190.72.216         QUIC     1401   Initial, DCID=8b8b5ea1666b7db7, SCID=35fc40, PKN: 0, CRYPTO

Frame 68: 1401 bytes on wire (11208 bits), 1401 bytes captured (11208 bits)
Linux cooked capture v1
Internet Protocol Version 4, Src: 10.0.3.15, Dst: 35.190.72.216
User Datagram Protocol, Src Port: 42054, Dst Port: 443
QUIC IETF
QUIC IETF

No.     Time           Source                Destination           Protocol Length Info
     69 12.854732      10.0.3.15             35.190.72.216         TCP      76     37768 → 443 [SYN] Seq=0 Win=32120 Len=0 MSS=1460 SACK_PERM=1 TSval=1830539605 TSecr=0 WS=128

Frame 69: 76 bytes on wire (608 bits), 76 bytes captured (608 bits)
Linux cooked capture v1
Internet Protocol Version 4, Src: 10.0.3.15, Dst: 35.190.72.216
Transmission Control Protocol, Src Port: 37768, Dst Port: 443, Seq: 0, Len: 0

No.     Time           Source                Destination           Protocol Length Info
     70 12.863637      18.239.208.10         10.0.3.15             TCP      62     443 → 53674 [SYN, ACK] Seq=0 Ack=1 Win=65535 Len=0 MSS=1460

Frame 70: 62 bytes on wire (496 bits), 62 bytes captured (496 bits)
Linux cooked capture v1
Internet Protocol Version 4, Src: 18.239.208.10, Dst: 10.0.3.15
Transmission Control Protocol, Src Port: 443, Dst Port: 53674, Seq: 0, Ack: 1, Len: 0

No.     Time           Source                Destination           Protocol Length Info
     71 12.863667      10.0.3.15             18.239.208.10         TCP      56     53674 → 443 [ACK] Seq=1 Ack=1 Win=32120 Len=0

Frame 71: 56 bytes on wire (448 bits), 56 bytes captured (448 bits)
Linux cooked capture v1
Internet Protocol Version 4, Src: 10.0.3.15, Dst: 18.239.208.10
Transmission Control Protocol, Src Port: 53674, Dst Port: 443, Seq: 1, Ack: 1, Len: 0

No.     Time           Source                Destination           Protocol Length Info
     72 12.863816      10.0.3.15             18.239.208.10         TLSv1.2  264    Client Hello

Frame 72: 264 bytes on wire (2112 bits), 264 bytes captured (2112 bits)
Linux cooked capture v1
Internet Protocol Version 4, Src: 10.0.3.15, Dst: 18.239.208.10
Transmission Control Protocol, Src Port: 53674, Dst Port: 443, Seq: 1, Ack: 1, Len: 208
Transport Layer Security

No.     Time           Source                Destination           Protocol Length Info
     73 12.863976      18.239.208.10         10.0.3.15             TCP      62     443 → 53674 [ACK] Seq=1 Ack=209 Win=65535 Len=0

Frame 73: 62 bytes on wire (496 bits), 62 bytes captured (496 bits)
Linux cooked capture v1
Internet Protocol Version 4, Src: 18.239.208.10, Dst: 10.0.3.15
Transmission Control Protocol, Src Port: 443, Dst Port: 53674, Seq: 1, Ack: 209, Len: 0

No.     Time           Source                Destination           Protocol Length Info
     74 12.864506      35.201.103.21         10.0.3.15             TCP      62     443 → 46060 [SYN, ACK] Seq=0 Ack=1 Win=65535 Len=0 MSS=1460

Frame 74: 62 bytes on wire (496 bits), 62 bytes captured (496 bits)
Linux cooked capture v1
Internet Protocol Version 4, Src: 35.201.103.21, Dst: 10.0.3.15
Transmission Control Protocol, Src Port: 443, Dst Port: 46060, Seq: 0, Ack: 1, Len: 0

No.     Time           Source                Destination           Protocol Length Info
     75 12.864537      10.0.3.15             35.201.103.21         TCP      56     46060 → 443 [ACK] Seq=1 Ack=1 Win=32120 Len=0

Frame 75: 56 bytes on wire (448 bits), 56 bytes captured (448 bits)
Linux cooked capture v1
Internet Protocol Version 4, Src: 10.0.3.15, Dst: 35.201.103.21
Transmission Control Protocol, Src Port: 46060, Dst Port: 443, Seq: 1, Ack: 1, Len: 0

No.     Time           Source                Destination           Protocol Length Info
     76 12.865737      10.0.3.15             35.201.103.21         TLSv1.3  573    Client Hello

Frame 76: 573 bytes on wire (4584 bits), 573 bytes captured (4584 bits)
Linux cooked capture v1
Internet Protocol Version 4, Src: 10.0.3.15, Dst: 35.201.103.21
Transmission Control Protocol, Src Port: 46060, Dst Port: 443, Seq: 1, Ack: 1, Len: 517
Transport Layer Security

No.     Time           Source                Destination           Protocol Length Info
     77 12.865882      35.201.103.21         10.0.3.15             TCP      62     443 → 46060 [ACK] Seq=1 Ack=518 Win=65535 Len=0

Frame 77: 62 bytes on wire (496 bits), 62 bytes captured (496 bits)
Linux cooked capture v1
Internet Protocol Version 4, Src: 35.201.103.21, Dst: 10.0.3.15
Transmission Control Protocol, Src Port: 443, Dst Port: 46060, Seq: 1, Ack: 518, Len: 0

No.     Time           Source                Destination           Protocol Length Info
     78 12.881806      35.190.72.216         10.0.3.15             TCP      62     443 → 37768 [SYN, ACK] Seq=0 Ack=1 Win=65535 Len=0 MSS=1460

Frame 78: 62 bytes on wire (496 bits), 62 bytes captured (496 bits)
Linux cooked capture v1
Internet Protocol Version 4, Src: 35.190.72.216, Dst: 10.0.3.15
Transmission Control Protocol, Src Port: 443, Dst Port: 37768, Seq: 0, Ack: 1, Len: 0

No.     Time           Source                Destination           Protocol Length Info
     79 12.881824      10.0.3.15             35.190.72.216         TCP      56     37768 → 443 [ACK] Seq=1 Ack=1 Win=32120 Len=0

Frame 79: 56 bytes on wire (448 bits), 56 bytes captured (448 bits)
Linux cooked capture v1
Internet Protocol Version 4, Src: 10.0.3.15, Dst: 35.190.72.216
Transmission Control Protocol, Src Port: 37768, Dst Port: 443, Seq: 1, Ack: 1, Len: 0

No.     Time           Source                Destination           Protocol Length Info
     80 12.883180      10.0.3.15             35.190.72.216         TLSv1.3  573    Client Hello

Frame 80: 573 bytes on wire (4584 bits), 573 bytes captured (4584 bits)
Linux cooked capture v1
Internet Protocol Version 4, Src: 10.0.3.15, Dst: 35.190.72.216
Transmission Control Protocol, Src Port: 37768, Dst Port: 443, Seq: 1, Ack: 1, Len: 517
Transport Layer Security

No.     Time           Source                Destination           Protocol Length Info
     81 12.883400      35.190.72.216         10.0.3.15             TCP      62     443 → 37768 [ACK] Seq=1 Ack=518 Win=65535 Len=0

Frame 81: 62 bytes on wire (496 bits), 62 bytes captured (496 bits)
Linux cooked capture v1
Internet Protocol Version 4, Src: 35.190.72.216, Dst: 10.0.3.15
Transmission Control Protocol, Src Port: 443, Dst Port: 37768, Seq: 1, Ack: 518, Len: 0

No.     Time           Source                Destination           Protocol Length Info
     82 12.888590      35.190.72.216         10.0.3.15             QUIC     1401   Handshake, DCID=35fc40, SCID=eb8b5ea1666b7db7

Frame 82: 1401 bytes on wire (11208 bits), 1401 bytes captured (11208 bits)
Linux cooked capture v1
Internet Protocol Version 4, Src: 35.190.72.216, Dst: 10.0.3.15
User Datagram Protocol, Src Port: 443, Dst Port: 42054
QUIC IETF
QUIC IETF

